<?xml version="1.0" encoding="UTF-8" ?>
<!DOCTYPE restaurant SYSTEM "restaurant.dtd">
<restaurant>
    <client>
        <login>demo_client_1</login>
        <email>demo_client_1@demo.com</email>
        <password>demo</password>
        <client_info>
            <firstName>client_firstName</firstName>
            <secondName>client_secondName</secondName>
            <address>
                <city>client_city</city>
                <street>client_street</street>
                <house>3</house>
                <apartment>15</apartment>
            </address>
            <phoneNumber>375291234567</phoneNumber>
            <creditCard>3214435600013498</creditCard>
        </client_info>
    </client>
    <admin>
        <login>demo_admin</login>
        <password>demo</password>
    </admin>
</restaurant>